{
  "$schema":"./REPO_HYGIENE_STATE.schema.json",
  "schema_version":"1.0.0",
  "program_id":"AURA-REPO-HYGIENE",
  "program_status":"completed",
  "updated_at":"2026-08-12T14:19:57Z",
  "session_id":"AURA-REPO-HYGIENE-H010-PROJECTION-RECONCILIATION-20260812",
  "repository":{
    "branch":"main",
    "head":"b4610f0a06d3a408f76a38c9b05175ef0de82b11",
    "remote_head":"b4610f0a06d3a408f76a38c9b05175ef0de82b11",
    "working_tree_state":"clean"
  },
  "active_prompt":"H-010",
  "active_state":"completed",
  "completed_prompts":["H-000","H-001","H-002","H-003","H-004","H-005","H-006","H-007","H-008","H-009","H-010"],
  "blocked_prompts":[],
  "evidence_ids":["EV-REPO-HYGIENE-20260809-PROGRAM-01","EV-REPO-HYGIENE-20260809-DELIVERY-02","EV-REPO-HYGIENE-H-000-20260809-01","EV-REPO-HYGIENE-H-000-20260809-02","EV-REPO-HYGIENE-H-001-20260809-01","EV-REPO-HYGIENE-H-001-CLOSEOUT-20260809-01","EV-REPO-HYGIENE-H-001-20260809-02","EV-REPO-HYGIENE-H-001-CLOSEOUT-20260809-02","EV-REPO-HYGIENE-H-002-20260809-01","EV-REPO-HYGIENE-H-002-CLOSEOUT-20260809-01","EV-REPO-HYGIENE-H-003-20260809-01","EV-REPO-HYGIENE-H-003-CLOSEOUT-20260809-01","EV-REPO-HYGIENE-H-004-20260810-01","EV-REPO-HYGIENE-H-004-CLOSEOUT-20260810-01","EV-REPO-HYGIENE-H-005-20260810-01","EV-REPO-HYGIENE-H-005-CLOSEOUT-20260810-01","EV-REPO-HYGIENE-H-005-20260810-02","EV-REPO-HYGIENE-H-005-CLOSEOUT-20260810-02","EV-REPO-HYGIENE-H-006-20260810-01","EV-REPO-HYGIENE-H-006-CLOSEOUT-20260810-01","EV-REPO-HYGIENE-H-007-20260810-01","EV-REPO-HYGIENE-H-007-CLOSEOUT-20260810-01","EV-REPO-HYGIENE-H-007-20260810-02","EV-REPO-HYGIENE-H-007-CLOSEOUT-20260810-02","EV-REPO-HYGIENE-H-007-CLOSEOUT-20260810-03","EV-REPO-HYGIENE-H-008-20260810-01","EV-REPO-HYGIENE-H-008-CLOSEOUT-20260810-01","EV-REPO-HYGIENE-H-008-DELIVERY-20260810-01","EV-REPO-HYGIENE-H-008-QUARANTINE-20260810-01","EV-REPO-HYGIENE-H-009-20260810-01","EV-REPO-HYGIENE-H-009-CLOSEOUT-20260810-01","EV-REPO-HYGIENE-H-010-20260810-01","EV-REPO-HYGIENE-H-010-CLOSEOUT-20260810-01","EV-REPO-HYGIENE-H-010-RECONCILIATION-20260810-01","EV-REPO-HYGIENE-REMEDIATION-20260810-01","EV-REPO-HYGIENE-REMEDIATION-CLOSEOUT-20260810-01","EV-REPO-HYGIENE-DEPENDENCY-REMEDIATION-20260811-01","EV-REPO-HYGIENE-REMEDIATION-VERIFY-20260811-01","EV-REPO-HYGIENE-GIT-ADOPTION-20260811-01","EV-REPO-HYGIENE-TOOLCHAIN-20260811-01","EV-REPO-HYGIENE-COVERAGE-HOST-BOUNDARY-20260811-01","EV-REPO-HYGIENE-HOSTED-CI-20260811-01","EV-REPO-HYGIENE-HOSTED-CI-FINAL-20260811-01","EV-REPO-HYGIENE-MAIN-CI-FINAL-20260811-01","EV-REPO-HYGIENE-MAIN-CI-CURRENT-20260811-01","EV-REPO-HYGIENE-TOOLCHAIN-XCODE-20260811-01","EV-REPO-HYGIENE-H-010-REVALIDATION-20260811-01","EV-REPO-HYGIENE-H-010-CLOSEOUT-20260811-01","EV-REPO-HYGIENE-H-010-SWIFTLINT-REMEDIATION-20260812-01","EV-REPO-HYGIENE-H-010-CLOSEOUT-20260812-01","EV-REPO-HYGIENE-H-010-DELIVERY-20260812-01","EV-REPO-HYGIENE-H-010-FINAL-20260812-01","EV-REPO-HYGIENE-H-010-MAIN-SYNC-20260812-01","EV-REPO-HYGIENE-H-010-HOSTED-BLOCKED-20260812-01","EV-REPO-HYGIENE-H-010-HOSTED-CI-FINAL-20260812-01","EV-REPO-HYGIENE-H-010-PROJECTION-RECONCILIATION-20260812-01"],
  "open_gap_ids":["HYGIENE-00","HYGIENE-01","HYGIENE-02","HYGIENE-03","HYGIENE-04","HYGIENE-05","HYGIENE-06","HYGIENE-07","HYGIENE-08","HYGIENE-09","HYGIENE-10"],
  "authority":{
    "edit_control_plane":false,
    "edit_product_code":false,
    "destructive_cleanup":false,
    "git_recovery_mutation":false,
    "install_tools_or_dependencies":false,
    "commit_push_merge":false,
    "release_or_deploy":false
  },
  "control_files":{
    "program_document":"docs/operations/REPO_HYGIENE_PROGRAM.md",
    "read_first":"AURA_RUNTIME_COMPLETION/context/REPO_HYGIENE_READ_FIRST.md",
    "control_contract":"AURA_RUNTIME_COMPLETION/repo-hygiene/REPO_HYGIENE_CONTROL_CONTRACT.md",
    "prompt_contract":"AURA_RUNTIME_COMPLETION/repo-hygiene/REPO_HYGIENE_PROMPT_CONTRACT.md",
    "manifest":"AURA_RUNTIME_COMPLETION/repo-hygiene/REPO_HYGIENE_PROMPT_MANIFEST.json",
    "ledger":"AURA_RUNTIME_COMPLETION/repo-hygiene/REPO_HYGIENE_LEDGER.md",
    "validator":"scripts/validate_repo_hygiene_program.py"
  },
  "next_action":"H-010 is terminally complete on current main projection b4610f0a06d3a408f76a38c9b05175ef0de82b11. The hosted governance/build/test evidence was executed on workflow/source SHA 6d4d6da382cd94cd3ac006e26e6f0502eacb9ea8; subsequent descendants are control-plane-only projections. Local strict SwiftLint, formatter, build, full tests, fsck, coverage, and all governance validators pass; hosted run 31598491689 passed governance/build-and-test, 21/21 bundles, 70.59% coverage, development-unverified artifact validation, and two-file artifact upload. Stop at the end of the manifest: no H-011 exists and no product, beta, signing, release, or deployment completion is implied."
}
